{"meta_schemas":{"protocol-bundle":{"path":"formal/reviews/meta-schemas/review-protocol-bundle-v6.schema.json","sha256":"b4cfc0ca7b577e2d37f048d9cb7bb5d546c77a6dffed2100340e05d52b525e78"},"review-evidence":{"path":"formal/reviews/meta-schemas/review-evidence-v5.schema.json","sha256":"0f66a468c5afc0909389bf3bece221cc083e05a52f9e19be8b41c7e24d3e01bc"}},"policies":{"artifact_lifecycle":{"predecessor_chain_required":true,"protocol_changes_require_new_artifact_paths":true,"referenced_artifacts_immutable_by_path":true},"challenge":{"exact_input_packet_binding_required":true,"incidental_findings_allowed":false,"max_closure_revisions":1,"semantic_result_model_shopping_allowed":false},"decision_request":{"scope":"full-current-subject-plus-current-protocol-plus-finding"},"external_outcomes":["GATE-A-READY","DECISION-REQUIRED","OPERATOR-ACTION-REQUIRED"],"model_identity":{"effective_duplicate_fields":["provider","model_version"],"identity_fields":["provider","model","model_version"],"provider_reported_resolution":"provider-owned-canonical-effective-model-identity-v1"},"normalization":{"mode":"one-to-one","semantic_deduplication_allowed":false,"semantic_merge_allowed":false},"retry":{"all_completed_attempts_must_be_sealed":true,"deterministically_validated_roles":["initial-reviewer","challenge"],"first_protocol_valid_completion_is_terminal":true,"outcome_classification":"role-aware-conservative","roles_without_deterministic_output_validator":["materiality-assessor","refutation-builder","discovery-classifier","derivation-builder","decision-necessity-challenger","repair-synthesizer","decision-projection"],"roles_without_deterministic_output_validator_first_completed_response_terminal":true,"roles_without_deterministic_output_validator_protocol_invalid_allowed":false,"schema_invalid_completion_retry_allowed":true,"semantic_result_retry_allowed":false,"technical_retry_allowed":true},"reviewer_acquisition":{"mode":"minimum-effective-independent-v1","profile_order":[]}},"predecessor":{"path":"formal/reviews/protocols/gate-a-campaign-protocol-v5.json","sha256":"b9dc015188b89f605bf8252bf47ff5497be54668cc274e953146577f1a76e091"},"prompts":{"adjudication":{"path":"formal/reviews/prompts/gate-a-adjudication-v1.md","sha256":"76a342dd88f2566a9fa40ee3b9f5ccbd6d5b399de822227b3ccd451774dc2f50"},"challenge":{"path":"formal/reviews/prompts/gate-a-challenge-v1.md","sha256":"b5fef8fd42eef80175556322c8067dc5ea9c1eb66869061e22ef194a434aeb65"},"initial-reviewer":{"path":"formal/reviews/prompts/gate-a-initial-review-v1.md","sha256":"516c63b4df16c72fb7ac1718fa4af5a9ab402e0ecf9c460d44a65858b7862748"},"repair":{"path":"formal/reviews/prompts/gate-a-repair-v1.md","sha256":"3c7e1e97667c5f0e3d2e578d6c256a22cf5227b66865f858421cc7d23dad5a6c"}},"protocol_bundle_schema_version":6,"protocol_id":"gate-a-campaign-protocol-v6","review_class":"assurance-decomposition","reviewer_profiles":[],"schemas":{"challenge-output":{"path":"formal/reviews/schemas/challenge-output-v1.schema.json","sha256":"418245a1619b51090fc52e431996f05303ce6f38736423212879b6cb768419f2"},"challenge-packet":{"path":"formal/reviews/schemas/challenge-packet-v1.schema.json","sha256":"82f8c7956c860235def469a1975c3baf9572091bd9ce39b709bd1547338911ba"},"execution-receipt":{"path":"formal/reviews/schemas/execution-receipt-v3.schema.json","sha256":"7432767a0714324214bafe3f79856ac4ea34badd21c3a0a97ee70e4bc1865d72"},"raw-review-output":{"path":"formal/reviews/schemas/raw-review-output-v1.schema.json","sha256":"ab9c8f7c8d0e0314a925a7feb589975c98314c0e47e70c7794c1e1443aca8b6c"}}}
